,input,acp,output
76,"Managers can read and set ordinary employees’ bonuses, but not those of other managers or the director.",1.0,{decision: allow; subject: manager; action: read; resource: ordinary employee bonus; purpose: none; condition: none | decision: allow; subject: manager; action: set; resource: ordinary employee bonus; purpose: none; condition: none | decision: deny; subject: manager; action: read; resource: manager bonuses; purpose: none; condition: none | decision: deny; subject: manager; action: set; resource: manager bonus; purpose: none; condition: none | decision: deny; subject: manager; action: read; resource: director bonus; purpose: none; condition: none | decision: deny; subject: manager; action: set; resource: director bonus; purpose: none; condition: none}
77,Supervisor can not  execute the write a check use case.,1.0,{decision: deny; subject: supervisor; action: execute; resource: write a check use case; purpose: none; condition: none}
78,"For example, a user should not record and verify the same invoice.",1.0,{decision: deny; subject: user; action: record; resource: invoice; purpose: none; condition: none | decision: deny; subject: user; action: verify; resource: invoice; purpose: none; condition: none}
79,Every subject in the hierarchy except the business office manager can submit a project.,1.0,{decision: allow; subject: subject; action: submit; resource: project; purpose: none; condition: none | decision: deny; subject: business office manager; action: submit; resource: project; purpose: none; condition: none}
80,"Every professor, except assistant professors, can review a project.",1.0,{decision: allow; subject: professor; action: review; resource: project; purpose: none; condition: none | decision: deny; subject: assistant professor; action: review; resource: project; purpose: none; condition: none}
81,A subject cannot review a project he or she has submitted.,1.0,{decision: deny; subject: subject; action: review; resource: project; purpose: none; condition: subject submitted the project}
82,A subject cannot approve projects he or she has reviewed or submitted.,1.0,{decision: deny; subject: subject; action: approve; resource: project; purpose: none; condition: none}
83,Authors of papers cannot be changed.,1.0,{decision: deny; subject: none; action: change; resource: author of paper; purpose: none; condition: none}
84,"The PC chair can assign a paper to a PC member for reviewing, except if he is one of its authors.",1.0,{decision: deny; subject: pc chair; action: assign; resource: paper; purpose: reviewing; condition: he is one of its authors}
85,"All PC members, except the author(s) of a paper can know who are the reviewers for this paper.",1.0,{decision: allow; subject: pc member; action: know; resource: reviewer; purpose: none; condition: none | decision: deny; subject: author of paper; action: know; resource: reviewers; purpose: none; condition: none}
86,"A reviewer of a paper can resign, unless he has already appointed a sub-reviewer for the paper.",1.0,{decision: deny; subject: reviewer; action: resign; resource: none; purpose: none; condition: he has already appointed a sub-reviewer for the paper}
87,"A sub-reviewer can resign, unless he has already submitted his review.",1.0,{decision: allow; subject: sub-reviewer; action: resign; resource: none; purpose: none; condition: he has not submitted his review}
88,There do not exist members of Student who can Assign ExternalGrades.,1.0,{decision: deny; subject: member of student; action: assign; resource: externalgrades; purpose: none; condition: none}
89,No combination of roles exists such that a user with those roles can both Receive and Assign the resource ExternalGrades.,1.0,{decision: deny; subject: user; action: receive; resource: externalgrades; purpose: none; condition: none | decision: deny; subject: user; action: assign; resource: externalgrades; purpose: none; condition: none}
90,"TA can view and assign InternalGrades but not ExternalGrades (since faculty must take final responsibility for all external grades), combined with Pol3.",1.0,{decision: allow; subject: ta; action: view; resource: internalgrades; purpose: none; condition: none | decision: allow; subject: ta; action: assign; resource: internalgrades; purpose: none; condition: none | decision: deny; subject: ta; action: view; resource: externalgrades; purpose: none; condition: none | decision: deny; subject: ta; action: assign; resource: externalgrades; purpose: none; condition: none}
91,"If the subject is a student, then do not permit that subject to assign grades.",1.0,{decision: deny; subject: subject; action: assign; resource: grade; purpose: none; condition: subject is a student}
92,"Although she can enter the past medical records when a resident is admitted, she cannot subsequently add medical entries to the system.",1.0,{decision: allow; subject: she; action: enter; resource: past medical record; purpose: none; condition: resident is admitted | decision: deny; subject: she; action: add; resource: medical entry; purpose: none; condition: none}
93,"Also, she cannot view the private notes of doctors and clearly she cannot sign the legal agreement on behalf of a resident.",1.0,{decision: deny; subject: she; action: view; resource: private note; purpose: none; condition: none | decision: deny; subject: she; action: sign; resource: legal agreement; purpose: none; condition: none}
94,Health care workers can view recent medical records of residents (up to one year old) but cannot normally view older medical information.,1.0,{decision: allow; subject: health care worker; action: view; resource: recent medical record; purpose: none; condition: none | decision: deny; subject: health care worker; action: view; resource: older medical information; purpose: none; condition: none}
95,"So, for example, the manager should be made aware of repeated attempts by a health care worker to access information beyond their rights.",1.0,{decision: allow; subject: manager; action: aware; resource: repeated attempt; purpose: none; condition: none}
96,"Doctors also can add private notes about a resident, which, on the basis of doctor-patient confidentiality, are not visible to health care staff or the manager.",1.0,{decision: allow; subject: doctor; action: add; resource: private note; purpose: none; condition: none | decision: deny; subject: health care staff; action: view; resource: private note; purpose: none; condition: none | decision: deny; subject: manager; action: view; resource: private note; purpose: none; condition: none}
97,The doctor then has temporary access to the resident’s medical records (but not to the private notes of the resident’s usual doctor).,1.0,{decision: allow; subject: doctor; action: access; resource: medical record; purpose: none; condition: none | decision: deny; subject: doctor; action: access; resource: private note; purpose: none; condition: none}
98,In an electronic system we can allow residents to hook into the network at any time as long as they can view only their own data and cannot make arbitrary changes.,1.0,{decision: allow; subject: resident; action: hook; resource: network; purpose: none; condition: they can view only their own data and cannot make arbitrary changes}
99,This critical task should not be performed by a single user.,1.0,{decision: deny; subject: user; action: perform; resource: critical task; purpose: none; condition: none}
100,"However, it should not perform these operations when it is loading medicines to the medicine dispenser.",1.0,{decision: deny; subject: it; action: perform; resource: operations; purpose: none; condition: it is loading medicines to the medicine dispenser}
101,Pharmacy System should not read patient records even if it can read patient medicine orders.,1.0,{decision: deny; subject: pharmacy system; action: read; resource: patient record; purpose: none; condition: none | decision: allow; subject: pharmacy system; action: read; resource: patient medicine order; purpose: none; condition: none}
102,An administrator shall not be permitted to read or write to medical elements of a patient record.,1.0,{decision: deny; subject: administrator; action: read; resource: medical element; purpose: none; condition: none | decision: deny; subject: administrator; action: write; resource: medical element; purpose: none; condition: none}
103,"Users can view an Owner's account, but not make changes",1.0,{decision: allow; subject: user; action: view; resource: owner account; purpose: none; condition: none | decision: deny; subject: user; action: change; resource: owner account; purpose: none; condition: none}
104,"Only administrators, not data owners, make changes to a resource's security label.",1.0,{decision: allow; subject: administrator; action: change; resource: security label; purpose: none; condition: none | decision: deny; subject: data owner; action: change; resource: security label; purpose: none; condition: none}
105,Owners cannot change any data but can read it all.,1.0,{decision: allow; subject: owner; action: read; resource: data; purpose: none; condition: none | decision: deny; subject: owner; action: change; resource: data; purpose: none; condition: none}
106,There do not exist members of STUDENT who can ASSIGN EXTERNALGRADES.,1.0,{decision: deny; subject: student; action: assign; resource: externalgrades; purpose: none; condition: none}
107,There exists no combination of roles such that a user with those roles can both RECEIVE and ASSIGN the resource EXTERNALGRADES.,1.0,{decision: deny; subject: user; action: receive; resource: externalgrades; purpose: none; condition: none | decision: deny; subject: user; action: assign; resource: externalgrades; purpose: none; condition: none}
108,"If a subject is not a pc-chair or admin, then he or she may not set the meeting flag.",1.0,{decision: deny; subject: subject; action: set; resource: meeting flag; purpose: none; condition: subject is not a pc-chair or admin}
109,"If someone is not a pc-chair or admin, then he or she can never see paper-review-rc for which he or she is conflicted.",1.0,{decision: deny; subject: person; action: see; resource: paper-review-rc; purpose: none; condition: person is not a pc-chair or admin}
110,Authors may never read scores.,1.0,{decision: deny; subject: author; action: read; resource: score; purpose: none; condition: none}
111,Doctors need not sign a confidentiality agreement since they are bound by a code of professional conduct.,1.0,{decision: deny; subject: doctor; action: sign; resource: confidentiality agreement; condition: none; purpose: none}
