,input,acp,output
85,"Customer Service Reps, Pharmacists, and Billing Reps can collect and use customer name and date of birth to help confirm identity.",1.0,{decision: allow; subject: customer service rep; action: collect; resource: customer name; purpose: help confirm identity; condition: none | decision: allow; subject: customer service rep; action: collect; resource: date of birth; purpose: help confirm identity; condition: none | decision: allow; subject: customer service rep; action: use; resource: customer name; purpose: help confirm identity; condition: none | decision: allow; subject: customer service rep; action: use; resource: date of birth; purpose: help confirm identity; condition: none | decision: allow; subject: pharmacist; action: collect; resource: customer name; purpose: help confirm identity; condition: none | decision: allow; subject: pharmacist; action: collect; resource: date of birth; purpose: help confirm identity; condition: none | decision: allow; subject: pharmacist; action: use; resource: customer name; purpose: help confirm identity; condition: none | decision: allow; subject: pharmacist; action: use; resource: date of birth; purpose: help confirm identity; condition: none | decision: allow; subject: billing reps; action: collect; resource: customer name; purpose: help confirm identity; condition: none | decision: allow; subject: billing rep; action: collect; resource: date of birth; purpose: help confirm identity; condition: none | decision: allow; subject: billing rep; action: use; resource: customer name; purpose: help confirm identity; condition: none | decision: allow; subject: billing rep; action: use; resource: date of birth; purpose: help confirm identity; condition: none}
86,A subject cannot approve projects he or she has reviewed or submitted.,1.0,{decision: deny; subject: subject; action: approve; resource: project; purpose: none; condition: none}
87,"However, it should not perform these operations when it is loading medicines to the medicine dispenser.",1.0,{decision: deny; subject: it; action: perform; resource: operations; purpose: none; condition: it is loading medicines to the medicine dispenser}
88,"Privacy laws require, however, that a person should have full access to any information stored about them (unless the well-being of a third party would be jeopardised by revealing the information).",1.0,{decision: allow; subject: person; action: access; resource: information stored about them; purpose: none; condition: well being of a third party would not be jeopardised}
89,"So, for example, the manager should be made aware of repeated attempts by a health care worker to access information beyond their rights.",1.0,{decision: allow; subject: manager; action: aware; resource: repeated attempt; purpose: none; condition: none}
90,Pharmacy System can load medicines to the dispenser only at a time interval 12:00-13:00 in a day.,1.0,{decision: allow; subject: pharmacy system; action: load; resource: medicine; purpose: none; condition: at a time interval 12:00-13:00 in a day}
91,Administrators can access only the administrative pages,1.0,{decision: allow; subject: administrators; action: access; resource: administrative page; purpose: none; condition: none}
92,"Clerks can add and change the Name, the date of birth, the Address and the Postcode.",1.0,{decision: allow; subject: clerk; action: add; resource: name; purpose: none; condition: none | decision: allow; subject: clerk; action: add; resource: date of birth; purpose: none; condition: none | decision: allow; subject: clerk; action: add; resource: address; purpose: none; condition: none | decision: allow; subject: clerk; action: add; resource: postcode; purpose: none; condition: none | decision: allow; subject: clerk; action: change; resource: name; purpose: none; condition: none | decision: allow; subject: clerk; action: change; resource: date of birth; purpose: none; condition: none | decision: allow; subject: clerk; action: change; resource: address; purpose: none; condition: none | decision: allow; subject: clerk; action: change; resource: postcode; purpose: none; condition: none}
93,"Managers can read and set ordinary employees’ bonuses, but not those of other managers or the director.",1.0,{decision: allow; subject: manager; action: read; resource: ordinary employee bonus; purpose: none; condition: none | decision: allow; subject: manager; action: set; resource: ordinary employee bonus; purpose: none; condition: none | decision: deny; subject: manager; action: read; resource: manager bonuses; purpose: none; condition: none | decision: deny; subject: manager; action: set; resource: manager bonus; purpose: none; condition: none | decision: deny; subject: manager; action: read; resource: director bonus; purpose: none; condition: none | decision: deny; subject: manager; action: set; resource: director bonus; purpose: none; condition: none}
94,All members of role Faculty Family can receive External-Grades.,1.0,{decision: allow; subject: members of role faculty family; action: receive; resource: external-grade; purpose: none; condition: none}
95,Privacy laws require that the information be held for a certain period after a resident leaves the facility.,0.0,{decision: allow; subject: none; action: hold; resource: information; condition: none; purpose: none}
96,Only the business office manager and the dean can approve a project.,1.0,{decision: allow; subject: business office manager; action: approve; resource: project; purpose: none; condition: none | decision: allow; subject: dean; action: approve; resource: project; purpose: none; condition: none}
97,David can assign the manager role to Alice.,1.0,{decision: allow; subject: david; action: assign; resource: manager; purpose: none; condition: none}
98,Health care workers can view recent medical records of residents (up to one year old) but cannot normally view older medical information.,1.0,{decision: allow; subject: health care worker; action: view; resource: recent medical record; purpose: none; condition: none | decision: deny; subject: health care worker; action: view; resource: older medical information; purpose: none; condition: none}
99,Owners cannot change any data but can read it all.,1.0,{decision: allow; subject: owner; action: read; resource: data; purpose: none; condition: none | decision: deny; subject: owner; action: change; resource: data; purpose: none; condition: none}
100,This period is seven years for someone who is not of Aboriginal or Torres Strait Islander descent and nine years for someone who is.,0.0,{decision: allow; subject: none; action: none; resource: none; condition: none; purpose: none}
101,"Although she can enter the past medical records when a resident is admitted, she cannot subsequently add medical entries to the system.",1.0,{decision: allow; subject: she; action: enter; resource: past medical record; purpose: none; condition: resident is admitted | decision: deny; subject: she; action: add; resource: medical entry; purpose: none; condition: none}
102,The PC chair appoints the PC members.,1.0,{decision: allow; subject: pc chair; action: appoint; resource: pc member; purpose: none; condition: none}
103,"An employee can appoint another employee to be his advocate, and have read access to his bonus information – for example, this might be useful if he needs help from a trade union.",1.0,{decision: allow; subject: employee; action: appoint; resource: employee; purpose: be his advocate; condition: none | decision: allow; subject: employee; action: appoint; resource: employee; purpose: have read access to his bonus information; condition: none}
104,"Special add-on or plug-in software required to apply to an HTTP client to prevent indiscriminant copying by users (""cutting and pasting"" of information)",0.0,"{decision: allow; subject: none; action: apply; resource: special add-on or plug-in software required to apply to an http client; condition: none; purpose: to prevent indiscriminant copying by users ( "" cutting and pasting "" of information}"
105,"If the subject is not a faculty member, then permit that subject to enroll in courses.",1.0,{decision: allow; subject: subject; action: enroll; resource: courses; purpose: none; condition: subject is not a faculty member}
106,There do not exist members of Student who can Assign ExternalGrades.,1.0,{decision: deny; subject: member of student; action: assign; resource: externalgrades; purpose: none; condition: none}
107,"Occasionally, due to pressing circumstances, it may be necessary for a visiting doctor to examine a resident who is not normally his or her patient.",1.0,{decision: allow; subject: visiting doctor; action: examine; resource: resident; purpose: none; condition: none}
108,"In the current paper-based system, this is prevented by requiring that any new entry be signed by the doctor making that entry.",0.0,{decision: allow; subject: none; action: sign; resource: new entry; condition: none; purpose: none}
109,Owners can read Name.,1.0,{decision: allow; subject: owner; action: read; resource: name; purpose: none; condition: none}
110,"Every professor, except assistant professors, can review a project.",1.0,{decision: allow; subject: professor; action: review; resource: project; purpose: none; condition: none | decision: deny; subject: assistant professor; action: review; resource: project; purpose: none; condition: none}
111,Customer service reps can use credit card number for the purpose of updating records if requested by a patient.,1.0,{decision: allow; subject: customer service rep; action: use; resource: credit card number; purpose: updating records; condition: requested by a patient}
112,"During the meeting phase, reviewer can read the scores for paper if reviewer has submitted a review for paper.",1.0,{decision: allow; subject: reviewer; action: read; resource: scores for paper; purpose: none; condition: reviewer has submitted a review for paper}
113,This policy is claimed to prevent fraud and errors.,0.0,{decision: allow; subject: none; action: claim; resource: policy; condition: none; purpose: none}
114,"A physician may write to any medical element for which he or she is the designated primary care physician, provided an email is sent to the patient.",1.0,{decision: allow; subject: physician; action: write; resource: medical element; purpose: none; condition: email is sent to the patient}
115,An administrator shall not be permitted to read or write to medical elements of a patient record.,1.0,{decision: deny; subject: administrator; action: read; resource: medical element; purpose: none; condition: none | decision: deny; subject: administrator; action: write; resource: medical element; purpose: none; condition: none}
116,In an electronic system we can allow residents to hook into the network at any time as long as they can view only their own data and cannot make arbitrary changes.,1.0,{decision: allow; subject: resident; action: hook; resource: network; purpose: none; condition: they can view only their own data and cannot make arbitrary changes}
117,"During the review phase, reviewer may submit a review for paper if reviewer is assigned to review paper.",1.0,{decision: allow; subject: reviewer; action: submit; resource: review; purpose: none; condition: reviewer is assigned to review paper}
118,"In the current paper system, all the information stored about a resident is accessible to the resident by arrangement with the manager.",1.0,{decision: allow; subject: resident; action: access; resource: information; condition: none; purpose: none}
119,"A person, identified by his or her patient number, may read any record for which he or she is the designated patient.",1.0,{decision: allow; subject: person; action: read; resource: record; purpose: none; condition: none}
120,Supervisor can not  execute the write a check use case.,1.0,{decision: deny; subject: supervisor; action: execute; resource: write a check use case; purpose: none; condition: none}
121,"Doctors also can add private notes about a resident, which, on the basis of doctor-patient confidentiality, are not visible to health care staff or the manager.",1.0,{decision: allow; subject: doctor; action: add; resource: private note; purpose: none; condition: none | decision: deny; subject: health care staff; action: view; resource: private note; purpose: none; condition: none | decision: deny; subject: manager; action: view; resource: private note; purpose: none; condition: none}
122,Clerk can read from database.,1.0,{decision: allow; subject: clerk; action: read; resource: database; purpose: none; condition: none}
123,"Only one user, here is the Pharmacy System, can load medicines to the medicine dispenser.",1.0,{decision: allow; subject: user; action: load; resource: medicines; purpose: none; condition: none}
124,"All users are given read or write access to objects only of the same classification (a ""secret"" user can only read or write to a secret document).",1.0,{decision: allow; subject: user; action: read; resource: object; purpose: none; condition: none | decision: allow; subject: user; action: write; resource: objects; purpose: none; condition: none | decision: allow; subject: secret user; action: read; resource: secret document; purpose: none; condition: none | decision: allow; subject: secret user; action: write; resource: secret document; purpose: none; condition: none}
125,Financial consultants can collect and use customer name for the purpose of confirming identity.,1.0,{decision: allow; subject: financial consultant; action: collect; resource: customer name; purpose: confirming identity; condition: none | decision: allow; subject: financial consultant; action: use; resource: customer name; purpose: confirming identity; condition: none}
126,"The PC chair can assign a paper to a PC member for reviewing, except if he is one of its authors.",1.0,{decision: deny; subject: pc chair; action: assign; resource: paper; purpose: reviewing; condition: he is one of its authors}
127,Only Doctors and Nurses can read patient records.,1.0,{decision: allow; subject: doctor; action: read; resource: patient record; purpose: none; condition: none | decision: allow; subject: nurse; action: read; resource: patient record; purpose: none; condition: none}
128,"The manager has the broadest access to the information, including access to personal, financial, clinical and medical information about each resident.",1.0,{decision: allow; subject: manager; action: access; resource: personal information about each resident; purpose: none; condition: none | decision: allow; subject: manager; action: access; resource: financial information about each resident; purpose: none; condition: none | decision: allow; subject: manager; action: access; resource: medical information about each resident; purpose: none; condition: none | decision: allow; subject: manager; action: access; resource: clinical information about each resident; purpose: none; condition: none}
129,"For example, a user should not record and verify the same invoice.",1.0,{decision: deny; subject: user; action: record; resource: invoice; purpose: none; condition: none | decision: deny; subject: user; action: verify; resource: invoice; purpose: none; condition: none}
130,"Customer service reps, ducks or Lawyers can use credit card number for the purpose of making treatment decisions if customer has opted-in.",1.0,{decision: allow; subject: customer service rep; action: use; resource: credit card number; purpose: making treatment decisions; condition: customer has opted-in | decision: allow; subject: duck; action: use; resource: credit card number; purpose: making treatment decisions; condition: customer has opted-in | decision: allow; subject: lawyer; action: use; resource: credit card number; purpose: making treatment decisions; condition: customer has opted-in}
131,All members of STUDENT can RECEIVE EXTERNALGRADES.,1.0,{decision: allow; subject: member of student; action: receive; resource: externalgrades; purpose: none; condition: none}
132,Repetitive authorization failures to access the same resource or object generates an alarm possibly and possibly restricts the user's access,0.0,"{decision: allow; subject: reprobates; action: restrict; resource: ""users access""; condition: possibly; purpose: none | decision: allow; subject: reprobates; action: access; resource: same resource or object; condition: none; purpose: none}"
133,In an electronic system this overview must be supplied by some form of logging of accesses and access attempts.,0.0,{decision: allow; subject: none; action: supply; resource: overview; condition: none; purpose: none}
134,"Clearly, the manager does not wish to be informed about every access but some logging is still necessary.",0.0,{decision: allow; subject: manager; action: wish; resource: none; condition: clearly; purpose: none}
135,"Users can view an Owner's account, but not make changes",1.0,{decision: allow; subject: user; action: view; resource: owner account; purpose: none; condition: none | decision: deny; subject: user; action: change; resource: owner account; purpose: none; condition: none}
136,Their main form of access is to view the care plan for each resident and to add progress note entries based on their observations.,1.0,{decision: allow; subject: they; action: view; resource: care plan for each resident; purpose: none; condition: none | decision: allow; subject: they; action: add; resource: progress note entry; purpose: none; condition: none}
137,The reviewer of a paper can assign the paper to be sub-reviewed by an agent who is not an author of the paper and has not been assigned the same paper by another reviewer.,1.0,{decision: allow; subject: reviewer; action: assign; resource: paper; purpose: be sub-reviewed by an agent who is not an author of the paper and has not been assigned the same paper by another reviewer; condition: none}
138,Only the manager is allowed to delete the information about a resident but here also that right is restricted.,1.0,{decision: allow; subject: manager; action: delete; resource: information about a resident; purpose: none; condition: none}
139,"All users can read from a lower classification than the one they are granted (A ""secret"" user can read an unclassified document).",1.0,{decision: allow; subject: user; action: read; resource: lower classification; purpose: none; condition: none | decision: allow; subject: secret user; action: read; resource: unclassified document; purpose: none; condition: none}
