,input,acp,output
97,This use case allows the Registrar to maintain student information in the registration system.,1,{decision: allow; subject: registrar; action: maintain; resource: student information; purpose: none; condition: none}
98,The purpose of this document is to define requirements of the Course Registration System.,0,{decision: allow; subject: none; action: define; resource: requirements of the course registration system; condition: none; purpose: none}
99,"If there is no conflict, the system updates the course offering information for each offering the professor selects (i.e., records the professor as the instructor for the course offering).",1,{decision: allow; subject: system; action: update; resource: course offering information; purpose: none; condition: there is no conflict}
100,"Due to a decrease in federal funding, the college cannot afford to replace the entire system at once.",0,{decision: allow; subject: none; action: replace; resource: entire system; condition: none; purpose: none}
101,"If the Registrar selected “Update a Student”, the Update a Student  subflow is executed.",0,{decision: allow; subject: none; action: execute; resource: update a student  subflow; purpose: none; condition: registrar selected “update a student”}
102,The system deletes the Schedule.,1,{decision: allow; subject: system; action: delete; resource: schedule; purpose: none; condition: none}
103,The system requests that the Registrar enter the professor id,1,{decision: allow; subject: registrar; action: enter; resource: professor id; purpose: none; condition: none}
104,"This use case starts when a Student wishes to register for course offerings, or to change his or her existing course schedule.",0,{decision: allow; subject: none; action: start; resource: use case; purpose: none; condition: student wishes to register for course offerings_ or to change his or her existing course schedule}
105,The system must be able to complete 80% of all transactions within 2 minutes.,0,{decision: allow; subject: system; action: complete; resource: 80% of all transactions within 2 minutes; condition: none; purpose: none}
106,The system displays each student and any grade that was previously assigned for the offering.,1,{decision: allow; subject: system; action: display; resource: student; purpose: none; condition: none | decision: allow; subject: system; action: display; resource: grade; purpose: none; condition: none}
107,Create a Schedule,0,{decision: allow; subject: none; action: create; resource: schedule; condition: none; purpose: none}
108,The system cancels the course offering for each schedule that contains it.,1,{decision: allow; subject: system; action: cancel; resource: course offering; purpose: none; condition: none}
109,The system provides the Registrar with the new student id.,1,{decision: allow; subject: system; action: provide; resource: student id; purpose: none; condition: none}
110,"The course offering is marked as ""enrolled in"" in the schedule.",0,{decision: allow; subject: none; action: mark; resource: course offering; purpose: none; condition: none}
111,The system deletes the professor from the system.,1,{decision: allow; subject: system; action: delete; resource: professor; purpose: none; condition: none}
112,Update a Professor,0,{decision: allow; subject: none; action: update; resource: professor; condition: none; purpose: none}
113,The Registrar must be logged onto the system before this use case begins.,0,{decision: allow; subject: registrar; action: log; resource: registrar; condition: none; purpose: none}
114,The system validates the entered name and password and logs the actor into the system.,0,{decision: allow; subject: system; action: validate; resource: entered name; condition: none; purpose: none | decision: allow; subject: system; action: log; resource: entered password; condition: none; purpose: none}
115,The system shall provide access to the legacy course catalog database with no more than a 10 second latency.,0,{decision: allow; subject: system; action: provide; resource: legacy course database with no more than a 10 second latency; condition: none; purpose: none}
116,This use case allows a Student to view his or her report card for the previously completed semester.,1,{decision: allow; subject: student; action: view; resource: report card; purpose: none; condition: none}
117,Maintain Student Information,0,{decision: allow; subject: maintain student information; action: maintain; resource: student information; condition: none; purpose: none}
118,The professor selects possibly and possibly de-selects the course offerings that he or she wishes to teach for the upcoming semester.,1,{decision: allow; subject: professor; action: select; resource: course offering; purpose: none; condition: none | decision: allow; subject: professor; action: de-select; resource: course offering; purpose: none; condition: none}
119,The Professor selects a course offering.,1,{decision: allow; subject: professor; action: select; resource: course offering; purpose: none; condition: none}
120,"In addition, the professors will be able to record the grades for the students in each class.",1,{decision: allow; subject: professors; action: record; resource: grade; purpose: none; condition: none}
121,All the students enrolled in a particular course offering.,0,{decision: allow; subject: none; action: enroll; resource: students enrolled in a particular course offering; condition: none; purpose: none}
122,The system requests that the Registrar enter the student id,1,{decision: allow; subject: registrar; action: enter; resource: student id; purpose: none; condition: none}
123,"If the course offerings do not have at least three students at this point (some may have been added as a result of leveling), then the system cancels the course offering.",1,{decision: allow; subject: system; action: cancel; resource: course offering; purpose: none; condition: course offerings do not have at least three students at this point (some may have been added as a result of leveling)}
124,Add a Student,0,{decision: allow; subject: none; action: add; resource: student; condition: none; purpose: none}
125,"This includes adding, modifying, and deleting professors from the system.",1,{decision: allow; subject: none; action: add; resource: professors; purpose: none; condition: none | decision: allow; subject: none; action: modify; resource: professors; purpose: none; condition: none | decision: allow; subject: none; action: delete; resource: professors; purpose: none; condition: none}
126,"The Student can either select a different course offering and the use case continues, save the schedule, as is (see Save a Schedule subflow), or cancel the operation, at which point the Basic Flow is re-started at the beginning.",1,{decision: allow; subject: student; action: select; resource: course offering; purpose: none; condition: none | decision: allow; subject: student; action: save; resource: schedule; purpose: none; condition: none | decision: allow; subject: student; action: cancel; resource: operation; purpose: none; condition: none}
127,The system retrieves a list of available course offerings from the Course Catalog System and displays the list to the Student.,1,{decision: allow; subject: system; action: retrieve; resource: list of available course offering; purpose: none; condition: none | decision: allow; subject: system; action: display; resource: list of available course offering; purpose: none; condition: none}
128,"If, in the Basic Flow, the professor is not eligible to teach any course offerings in the upcoming semester, the system will display an error message.",1,{decision: allow; subject: system; action: display; resource: error message; purpose: none; condition: in the basic flow the professor is not eligible to teach any course offerings in the upcoming semester}
129,The system requests that the Registrar enter the student information.,1,{decision: allow; subject: registrar; action: enter; resource: student information; purpose: none; condition: none}
130,A course offering with fewer than three students will be canceled.,0,{decision: allow; subject: none; action: cancel; resource: course offering with fewer than three students; condition: none; purpose: none}
131,The Student must be logged onto the system before this use case begins.,0,{decision: allow; subject: none; action: log; resource: student; condition: none; purpose: none}
132,"Once the student has made his or her selections, the system updates the schedule for the Student using the selected course offerings.",1,{decision: allow; subject: system; action: update; resource: schedule; purpose: none; condition: student has made his or her selections}
133,A class offered by the university.,0,{decision: allow; subject: none; action: offer; resource: class offering; condition: none; purpose: none}
134,Students must be able to access the system during this time to add or drop courses.,1,{decision: allow; subject: student; action: access; resource: system; purpose: add courses; condition: none | decision: allow; subject: student; action: access; resource: system; purpose: drop courses; condition: none}
135,Professors must be able to access the on-line system to indicate which courses they will be teaching.,1,{decision: allow; subject: professors; action: access; resource: on-line system; purpose: indicate which courses professors will be teaching; condition: none}
136,The system also retrieves and displays the list of courses the professor has previously selected to teach.,1,{decision: allow; subject: system; action: retrieve; resource: list of courses; purpose: none; condition: none | decision: allow; subject: system; action: display; resource: list of courses; purpose: none; condition: none}
137,The Professor must be logged onto the system before this use case begins.,0,{decision: allow; subject: professor; action: log; resource: system; condition: none; purpose: none}
138,The system provides the Registrar with the new professor id.,1,{decision: allow; subject: system; action: provide; resource: professor id; purpose: none; condition: none}
139,The Supplementary Specifications and the use-case model together capture a complete set of requirements on the system.,0,{decision: allow; subject: none; action: capture; resource: complete set of requirements; condition: none; purpose: none}
140,"If the Registrar selected “Add a Student”, the Add a Student  subflow is executed.",0,{decision: allow; subject: none; action: execute; resource: add a student subflow; purpose: none; condition: registrar selected “add a student”}
141,The system displays a list of course offerings the Professor taught in the previous semester.,1,{decision: allow; subject: system; action: display; resource: list of course offerings; purpose: none; condition: none}
142,"If the system is unable to communicate with the Course Catalog System, the system will display an error message to the Student.",1,{decision: allow; subject: system; action: display; resource: error message; purpose: none; condition: system is unable to communicate with the course catalog system}
143,The system shall provide a Windows-based desktop interface.,0,{decision: allow; subject: system; action: provide; resource: windows-based desktop interface; condition: none; purpose: none}
144,"If a professor change is needed after registration has been closed, it is handled outside the scope of this system.",0,{decision: allow; subject: none; action: handle; resource: outside the scope of this system; condition: if a professor change is needed after registration has been closed; purpose: none}
145,The system used for processing billing information.,0,{decision: allow; subject: system; action: process; resource: billing information; condition: none; purpose: none}
146,"If the Registrar selected “Delete a Professor”, the Delete a Professor subflow is executed.",0,{decision: allow; subject: none; action: execute; resource: delete a professor subflow; purpose: none; condition: registrar selected “delete a professor”}
147,The system retrieves and displays the list of course offerings the professor is eligible to teach for the current semester.,1,{decision: allow; subject: system; action: retrieve; resource: list of course offerings; purpose: none; condition: none | decision: allow; subject: system; action: display; resource: list of course offerings; purpose: none; condition: none}
148,Add a Professor,0,{decision: allow; subject: none; action: add; resource: professor; condition: none; purpose: none}
149,"This includes adding, modifying, and deleting Students from the system.",0,{decision: allow; subject: none; action: add; resource: students; purpose: none; condition: none | decision: allow; subject: none; action: modify; resource: students; purpose: none; condition: none | decision: allow; subject: none; action: delete; resource: students; purpose: none; condition: none}
150,Multiple users must be able to perform their work concurrently.,0,{decision: allow; subject: multiple users; action: perform; resource: their work concurrently; condition: none; purpose: none}
151,"If the use case was successful, the actor is now logged into the system.",0,{decision: allow; subject: none; action: log; resource: use case; condition: if the use case was successful; purpose: none}
152,The professor acknowledges the message and the use case ends.,0,{decision: allow; subject: professor; action: acknowledge; resource: message; condition: none; purpose: none}
153,They will also need to see which students signed up for their course offerings.,1,{decision: allow; subject: they; action: see; resource: student; purpose: none; condition: none}
154,The course offerings not marked as “enrolled in” are marked as “selected” in the schedule.,0,{decision: allow; subject: none; action: mark; resource: course offerings not marked as “enrolled in”; purpose: none; condition: none}
155,"If it is, then a message is displayed to the Registrar, and the use case terminates.",1,{decision: allow; subject: none; action: display; resource: message; purpose: none; condition: none | decision: allow; subject: none; action: terminate; resource: use case; purpose: none; condition: none}
156,As the head of information systems for Wylie College you are tasked with developing a new student registration system.,0,{decision: allow; subject: none; action: develop; resource: new student registration system; condition: none; purpose: none}
157,"When the use case starts, if it is determined that registration for the current semester has been closed, a message is displayed to the Student, and the use case terminates.",1,{decision: allow; subject: none; action: display; resource: message; purpose: none; condition: it is determined that registration for the current semester has been closed | decision: allow; subject: none; action: terminate; resource: use case; purpose: none; condition: it is determined that registration for the current semester has been closed}
158,"If the Student selected “update a schedule”, the Update a Schedule subflow is executed.",0,{decision: allow; subject: none; action: execute; resource: update a schedule subflow; purpose: none; condition: student selected “update a schedule”}
159,"If the Professor wishes to skip a particular student, the grade information can be left blank and filled in at a later time.",1,{decision: allow; subject: professor; action: leave; resource: grade information; purpose: none; condition: professor wishes to skip a particular student | decision: allow; subject: professor; action: fill in; resource: grade information; purpose: none; condition: professor wishes to skip a particular student}
160,"In addition, each student will indicate two alternative choices in case the student cannot be assigned to a primary selection.",1,{decision: allow; subject: student; action: indicate; resource: alternative choice; purpose: none; condition: student cannot be assigned to a primary selection}
161,"If the Registrar selected “Add a Professor”, the Add a Professor  subflow is executed.",0,{decision: allow; subject: none; action: execute; resource: add a professor subflow; purpose: none; condition: registrar selected “add a professor”}
162,"When the Student indicates that he or she is done viewing the grades, the use case terminates.",0,{decision: allow; subject: none; action: terminate; resource: use case; purpose: none; condition: student indicates that he or she is done viewing the grades}
163,"If the system is unable to communicate with the Billing System, the system will attempt to re-send the request after a specified period.",1,{decision: allow; subject: system; action: re-send; resource: request; condition: system is unable to communicate with the billing system; purpose: none}
164,"If so, the system commits the course offering for each schedule that contains it.",1,{decision: allow; subject: system; action: commit; resource: course offering; purpose: none; condition: none}
165,The Close Registration processing cannot be performed if registration is in progress.,1,{decision: deny; subject: none; action: perform; resource: close registration processing; purpose: none; condition: registration is in progress}
166,The system retrieves and displays the student information.,1,{decision: allow; subject: system; action: retrieve; resource: student information; purpose: none; condition: none | decision: allow; subject: system; action: display; resource: student information; purpose: none; condition: none}
167,Only Professors can enter grades for students.,1,{decision: allow; subject: professor; action: enter; resource: grade; purpose: none; condition: none}
168,The system calculates the tuition owed by each student for his current semester schedule and sends a transaction to the Billing System.,1,{decision: allow; subject: system; action: calculate; resource: tuition; purpose: none; condition: none | decision: allow; subject: system; action: send; resource: transaction; purpose: none; condition: none}
169,The Registrar must be logged onto the system in order for this use case to begin.,0,{decision: allow; subject: registrar; action: log; resource: system in; condition: none; purpose: in order for this use case to begin}
170,"Once the Registrar updates the necessary information, the system updates the professor record.",1,{decision: allow; subject: system; action: update; resource: professor record; purpose: none; condition: registrar updates the necessary information}
171,"At the beginning of each semester, students may request a course catalogue containing a list of course offerings for the semester.",1,{decision: allow; subject: student; action: request; resource: course catalogue; purpose: none; condition: none}
172,"This specification defines the non-functional requirements of the system; such as reliability, usability, performance, and supportability, as well as functional requirements that are common across a number of use cases.",0,{decision: allow; subject: none; action: define; resource: non-functional requirements of the system; condition: none; purpose: none}
173,Select Courses to Teach,0,{decision: allow; subject: none; action: teach; resource: courses; condition: none; purpose: none}
174,"If the use case was successful, the student information is added, updated, or deleted from the system.",1,{decision: allow; subject: none; action: add; resource: student information; purpose: none; condition: use case was successful | decision: allow; subject: none; action: update; resource: student information; purpose: none; condition: use case was successful | decision: allow; subject: none; action: delete; resource: student information; purpose: none; condition: use case was successful}
175,This use case allows the Registrar to maintain professor information in the registration system.,1,{decision: allow; subject: registrar; action: maintain; resource: professor information; purpose: none; condition: none}
176,"This Supplementary Specification applies to the Course Registration System, which will be developed by the OOAD students.",0,{decision: allow; subject: none; action: apply; resource: course registration system; condition: none; purpose: none}
177,This use case allows a Professor to select the course offerings from the course catalog for the courses that he or she is eligible for and wishes to teach in the upcoming semester.,1,{decision: allow; subject: professor; action: select; resource: course offering; purpose: none; condition: none}
178,"If, in the Delete A Professor sub-flow, the Registrar decides not to delete the professor, the delete is cancelled, and the Basic Flow is re-started at the beginning.",1,{decision: allow; subject: none; action: re-start; resource: basic flow; purpose: none; condition: in the delete a professor sub-flow_ the registrar decides not to delete the professor_ the delete is cancelled}
179,"If a course fills up during the actual registration process, the student must be notified of the change before submitting the schedule for processing.",1,{decision: allow; subject: none; action: notify; resource: student; purpose: none; condition: course fills up during the actual registration process}
180,Update a Student,0,{decision: allow; subject: none; action: update; resource: student; condition: none; purpose: none}
181,"Once the Registrar provides the requested information, one of the sub flows is executed.",0,{decision: allow; subject: none; action: execute; resource: one of the sub flows; purpose: none; condition: registrar provides the requested information}
182,The system removes the professor from teaching the de-selected course offerings.,1,{decision: allow; subject: system; action: remove; resource: professor; purpose: none; condition: none}
183,The Student selects the course offerings to add from the list of available course offerings.,1,{decision: allow; subject: student; action: select; resource: course offering; purpose: add; condition: none}
184,"The system shall integrate with an existing legacy system, the Course Catalog System, which is an RDBMS database.",0,{decision: allow; subject: system; action: integrate; resource: course catalog system; condition: none; purpose: none | decision: allow; subject: system; action: integrate; resource: legacy system; condition: none; purpose: none}
185,The Student selects 4 primary course offerings and 2 alternate course offerings from the list of available offerings.,1,{decision: allow; subject: student; action: select; resource: primary course offering; purpose: none; condition: none | decision: allow; subject: student; action: select; resource: alternate course offering; purpose: none; condition: none}
186,"If, in the Update a Professor  or Delete a Professor sub-flows, a professor with the specified id number does not exist, the system displays an error message.",1,{decision: allow; subject: system; action: display; resource: error message; purpose: none; condition: professor with the specified id number does not exist in the update a professor  or delete a professor sub-flows}
187,"The Professor can either resolve the schedule conflict (i.e., by canceling his selection to teach one of the course offerings), or cancel the operation, in which case, any selections will be lost, and the use case ends.",1,{decision: allow; subject: professor; action: resolve; resource: schedule conflict; purpose: none; condition: none | decision: allow; subject: professor; action: cancel; resource: operation; purpose: none; condition: none}
188,The schedule is saved in the system.,0,{decision: allow; subject: none; action: save; resource: schedule; purpose: none; condition: none}
189,The Registrar enters the professor id.,1,{decision: allow; subject: registrar; action: enter; resource: professor id; purpose: none; condition: none}
190,The system will continue to attempt to re-send until the Billing System becomes available.,0,{decision: allow; subject: system; action: re-send; resource: billing system; condition: none; purpose: none}
191,The system requests that the Registrar enter the professor id.,1,{decision: allow; subject: registrar; action: enter; resource: professor id; purpose: none; condition: none}
192,"If, in the Delete A Schedule sub-flow, the Student decides not to delete the schedule, the delete is cancelled, and the Basic Flow is re-started at the beginning.",0,{decision: allow; subject: none; action: cancel; resource: the delete; purpose: none; condition: in the delete a schedule sub-flow_ the student decides not to delete the schedule | decision: allow; subject: none; action: re-start; resource: basic flow; purpose: none; condition: in the delete a schedule sub-flow_ the student decides not to delete the schedule}
193,"For each selected course offering on the schedule not already marked as “enrolled in”, the system verifies that the Student has the necessary prerequisites, that the course offering is open, and that there are no schedule conflicts.",1,{decision: allow; subject: system; action: verify; resource: prerequisite; purpose: none; condition: none | decision: allow; subject: system; action: verify; resource: course offering; purpose: none; condition: none | decision: allow; subject: system; action: verify; resource: schedule conflict; purpose: none; condition: none}
194,The new system will access course information from the legacy database but will not update it.,1,{decision: allow; subject: system; action: access; resource: course information; purpose: none; condition: none | decision: deny; subject: system; action: update; resource: course information; purpose: none; condition: none}
195,The system prompts the Registrar to confirm the deletion of the professor.,1,{decision: allow; subject: registrar; action: confirm; resource: deletion of the professor; purpose: none; condition: none}
