,Unnamed: 0,input,acp,output,origin
146,1380,HCP cannot print or edit demographic information if the patient's security rating or password is approved in accordance with standard format 6.1.,1.0,"{decision: deny; subject: hcp; action: print; resource: demographic information; purpose: none; condition: ""patients security rating or password is approved in accordance with standard format 6.1"" | decision: deny; subject: hcp; action: edit; resource: demographic information; purpose: none; condition: ""patients security rating or password is approved in accordance with standard format 6.1""}",collected_train
147,1383,"Many PC users, with the exception of one or more authors of an essay, can know who the reviewers of a project are.",1.0,{decision: allow; subject: pc users; action: know; resource: reviewers of a project; purpose: none; condition: none | decision: deny; subject: authors of an essay; action: know; resource: reviewers of a project; purpose: none; condition: none},collected_train
148,1384,"In an electronic system, we cannot allow residents to connect to the network at any time, as long as they can only view their own data and not make arbitrary changes.",1.0,{decision: deny; subject: residents; action: connect; resource: network; purpose: none; condition: they can only view their own data and not make arbitrary changes},collected_train
149,1395,A patient can report physiologic measurements.,1.0,{decision: allow; subject: patient; action: report; resource: physiologic measurement; purpose: none; condition: none},t2p
150,1408,"At this point, the LHCP can view a prescription list for that patient , sorted by start date (the later date is ranked earlier).",1.0,{decision: allow; subject: lhcp; action: view; resource: prescription list; purpose: none; condition: none},acre
151,1416,"An administrator enters a LHCP, an ER, or a public healh agent.",1.0,{decision: allow; subject: administrator; action: enter; resource: lhcp; purpose: none; condition: none | decision: allow; subject: administrator; action: enter; resource: er; purpose: none; condition: none | decision: allow; subject: administrator; action: enter; resource: public health agent; purpose: none; condition: none},t2p
152,1423,A fake email is sent to the patient or representative alerting the patient or representative that a new message reply has arrived.,1.0,{decision: allow; subject: none; action: send; resource: fake email; purpose: none; condition: none},acre
153,1437,"While she was able to enter the medical records of the past and a resident is admitted, Carol cannot add other entries to each system.",1.0,{decision: allow; subject: carol; action: enter; resource: medical records of the past; purpose: none; condition: none | decision: deny; subject: carol; action: add; resource: other entries; purpose: none; condition: none},collected_train
154,1444,"The admin must specify a specialty for a new LHCP (general physician, heart surgeon, OB-GYN, pediatrician, surgeon) and for a new LT ( blood, tissue, or general).",1.0,{decision: allow; subject: admin; action: specify; resource: specialty for a new lhcp; purpose: none; condition: none | decision: allow; subject: admin; action: specify; resource: specialty for a new lt; purpose: none; condition: none},acre
155,1460,An LHCP views a list of his upcoming appointments.,1.0,{decision: allow; subject: lhcp; action: view; resource: upcoming appointment; purpose: none; condition: none},t2p
156,1481,"In case the ’expertise-value’ is equal, the reviewer with the least number of papers assigned so far ’gets’ the paper.",1.0,{decision: allow; subject: reviewer; action: get; resource: paper; purpose: none; condition: ’expertise-value’ is equal},cyber
157,1489,"The LHCP requests a comprehensive report for all patients with a specified gender, age, and diagnosis .",1.0,{decision: allow; subject: lhcp; action: request; resource: report; purpose: none; condition: none},acre
158,1495,"The input data, a timestamp, and the fact that the status was reported by ""case manager"" and their MID are saved.",1.0,{decision: allow; subject: none; action: save; resource: input data; purpose: none; condition: none | decision: allow; subject: none; action: save; resource: timestamp; purpose: none; condition: none | decision: allow; subject: none; action: save; resource: fact; purpose: none; condition: none | decision: allow; subject: none; action: save; resource: mid; purpose: none; condition: none},acre
159,1513,Employees are allowed to submit expense claims with a receipt as proof for reimbursement.,1.0,{decision: allow; subject: employees; action: submit; resource: expense claims; condition: none; purpose: reimbursement},collected_train
160,1519,"That system must keep students from choosing study schedules other on their own, and professors from modifying their course schedule for other professors.",1.0,{decision: deny; subject: students; action: choose; resource: study schedules; purpose: none; condition: none | decision: deny; subject: professors; action: modify; resource: course schedule; purpose: none; condition: none},collected_train
161,1522,A patient can select to report physiologic measurements for those whose at least one physiologic data type is specified to be under monitoring and for whom he or she is a patient representative.,1.0,{decision: allow; subject: patient; action: report; resource: physiologic measurement; purpose: none; condition: none},acre
162,1539,"The patient may type a last name or partial last name, and optionally reduces the list of choices by providing the specialty.",1.0,{decision: allow; subject: patient; action: type; resource: last name; purpose: none; condition: none | decision: allow; subject: patient; action: type; resource: partial last name; purpose: none; condition: none | decision: allow; subject: patient; action: reduce; resource: list of choices; purpose: none; condition: none},t2p
163,1540,"All PC members, with the exception of the authors of a paper, can know who the reviewers of that work are.",1.0,{decision: allow; subject: pc members; action: know; resource: reviewers of that work; purpose: none; condition: none | decision: deny; subject: authors of a paper; action: know; resource: reviewers of that work; purpose: none; condition: none},collected_train
164,1541,"If the administrator is responsible, he may not change the reason ID number to open an account.",1.0,{decision: deny; subject: administrator; action: change; resource: reason id number; purpose: open an account; condition: administrator is responsible},collected_train
165,1546,"The system must prevent students from continuing a program that is inferior to their degree, but also from changing certain course offerings or other professors.",1.0,{decision: deny; subject: students; action: continue; resource: program; purpose: none; condition: none | decision: deny; subject: students; action: change; resource: course offerings; purpose: none; condition: none | decision: deny; subject: students; action: change; resource: other professors; purpose: none; condition: none},collected_train
166,1552,A patient reports an event related to a prescription drug or immunization reaction.,1.0,{decision: allow; subject: patient; action: report; resource: event; purpose: none; condition: none},t2p
167,1564,"A patient, personal representative or LHCP views prescription reports.",1.0,{decision: allow; subject: patient; action: view; resource: prescription report; purpose: none; condition: none | decision: allow; subject: lhcp; action: view; resource: prescription report; purpose: none; condition: none | decision: allow; subject: personal representative; action: view; resource: prescription report; purpose: none; condition: none},t2p
168,1596,An LHCP or UAP can add patients from his monitoring list.,1.0,{decision: allow; subject: lhcp; action: add; resource: patient; purpose: none; condition: none | decision: allow; subject: uap; action: add; resource: patient; purpose: none; condition: none},t2p
169,1611,The system shall append 20 more activities to the end of the currently listed activities on the same page.,1.0,{decision: allow; subject: system; action: append; resource: activity; condition: none; purpose: none},acre
170,1615,"In the list of in transit lab procedures , the Lab Technician can update the status to received when the sample has been received in his or her lab.",1.0,{decision: allow; subject: lab technician; action: update; resource: status; purpose: none; condition: in the list of in transit lab procedures},acre
171,1619,A reviewer of a work may resign unless he has already appointed a sub-reviewer for the work.,1.0,{decision: deny; subject: reviewer of a work; action: resign; resource: none; purpose: none; condition: he has already appointed a sub-reviewer for the work},collected_train
172,1645,A patient may view his or her own lab procedure results .,1.0,{decision: allow; subject: patient; action: view; resource: lab procedure result; purpose: none; condition: none},acre
173,1656,Practitioners cannot  add private notes about a resident.,1.0,{decision: deny; subject: practitioners; action: add; resource: private notes about a resident; purpose: none; condition: none},collected_train
174,1661,"Customer Service Reps, Pharmacists, and Billing Reps can collect and use customer name and e-mail addresses.",1.0,{decision: allow; subject: pharmacist; action: collect; resource: customer name; purpose: none; condition: none | decision: allow; subject: pharmacist; action: collect; resource: e-mail address; purpose: none; condition: none | decision: allow; subject: pharmacist; action: use; resource: customer name; purpose: none; condition: none | decision: allow; subject: pharmacist; action: use; resource: e-mail address; purpose: none; condition: none | decision: allow; subject: billing rep; action: collect; resource: customer name; purpose: none; condition: none | decision: allow; subject: billing rep; action: collect; resource: e-mail address; purpose: none; condition: none | decision: allow; subject: billing rep; action: use; resource: customer name; purpose: none; condition: none | decision: allow; subject: billing rep; action: use; resource: e-mail address; purpose: none; condition: none | decision: allow; subject: customer service rep; action: collect; resource: customer name; purpose: none; condition: none | decision: allow; subject: customer service rep; action: collect; resource: e-mail address; purpose: none; condition: none | decision: allow; subject: customer service rep; action: use; resource: customer name; purpose: none; condition: none | decision: allow; subject: customer service rep; action: use; resource: e-mail address; purpose: none; condition: none},collected
175,1664,A LHCP reviews the consultation.,1.0,{decision: allow; subject: lhcp; action: review; resource: consultation; purpose: none; condition: none},t2p
176,1672,The system displays a list of course offerings the Professor taught in the previous semester.,1.0,{decision: allow; subject: system; action: display; resource: list of course offerings; purpose: none; condition: none},ibm
177,1677,"All users are given read or write access to objects only of the same classification (a ""secret"" user can only read or write to a secret document).",1.0,{decision: allow; subject: user; action: read; resource: object; purpose: none; condition: none | decision: allow; subject: user; action: write; resource: objects; purpose: none; condition: none | decision: allow; subject: secret user; action: read; resource: secret document; purpose: none; condition: none | decision: allow; subject: secret user; action: write; resource: secret document; purpose: none; condition: none},collected
178,1680,The LHCP is unable to process or remove previous appointments.,1.0,{decision: deny; subject: lhcp; action: process; resource: previous appointments; purpose: none; condition: none | decision: deny; subject: lhcp; action: remove; resource: previous appointments; purpose: none; condition: none},collected_train
179,1702,A manager should be able to access the financial reports to analyze the company's performance.,1.0,"{decision: allow; subject: manager; action: access; resource: financial reports; condition: none; purpose: ""analyze the companys performance""}",collected_train
180,1703," ""Only managers and supervisors can access performance reports of their respective teams.""",1.0,{decision: allow; subject: managers; action: access; resource: performance reports; condition: none; purpose: none | decision: allow; subject: supervisors; action: access; resource: performance reports; condition: none; purpose: none},collected_train
181,1732,To complete the registration process the applicant must provide a valid email address.,1.0,{decision: allow; subject: applicant; action: provide; resource: email address; condition: none; purpose: complete the registration process},collected_train
182,1736,"The HCP must provide instructions, or else they cannot add the prescription.",1.0,{decision: allow; subject: hcp; action: provide; resource: instruction; purpose: none; condition: none | decision: deny; subject: hcp; action: add; resource: prescription; purpose: none; condition: none},t2p
183,1737,A user enters their MID and their password to gain role-based entry into the iTrust Medical Records system  or requests that their password be changed .,1.0,{decision: allow; subject: user; action: enter; resource: mid; purpose: gain role-based entry into the itrust medical records system; condition: none | decision: allow; subject: user; action: enter; resource: password; purpose: gain role-based entry into the itrust medical records system; condition: none | decision: allow; subject: user; action: request; resource: password; purpose: change; condition: none},acre
184,1740,Another physician then should not read the resident\'s doctor medical records to protect confidentiality ( then continues to obtain private notes regarding the resident ’ s resident doctor ).,1.0,{decision: deny; subject: another physician; action: read; resource: residents doctor medical records; purpose: protect confidentiality; condition: none | decision: deny; subject: another physician; action: obtain; resource: private notes; purpose: protect confidentiality; condition: none},collected_train
185,1741,"The HCP must enter this message to the person concerned, but is restricted to enter or edit this information.",1.0,{decision: allow; subject: hcp; action: enter; resource: message; purpose: none; condition: none | decision: deny; subject: hcp; action: enter; resource: information; purpose: none; condition: none | decision: deny; subject: hcp; action: edit; resource: information; purpose: none; condition: none},collected_train
186,1750,The LHCP must confirm the delete.,1.0,{decision: allow; subject: lhcp; action: confirm; resource: delete; purpose: none; condition: none},t2p
187,1755,"If the publisher allows electronic versions, the maintainer should send or upload the proceedings, for further preparation by the publisher.",1.0,{decision: allow; subject: maintainer; action: send; resource: proceeding; purpose: further preparation by the publisher; condition: publisher allows electronic versions | decision: allow; subject: maintainer; action: upload; resource: proceeding; purpose: further preparation by the publisher; condition: publisher allows electronic versions},cyber
188,1758,The patient can view contact information of a selected LHCP shown in the expired prescription list.,1.0,{decision: allow; subject: patient; action: view; resource: contact information; purpose: none; condition: none},t2p
189,1796,The representative views his message inbox.,1.0,{decision: allow; subject: representative; action: view; resource: message inbox; purpose: none; condition: none},t2p
190,1802,"The input data, a timestamp, and the fact that the status was reported by ""patient representative"" and his or her MID are saved.",1.0,{decision: allow; subject: none; action: save; resource: input data; purpose: none; condition: none | decision: allow; subject: none; action: save; resource: timestamp; purpose: none; condition: none | decision: allow; subject: none; action: save; resource: fact; purpose: none; condition: none | decision: allow; subject: none; action: save; resource: mid; purpose: none; condition: none},acre
191,1803,A non-editor resigns unless he has already completed his review.,1.0,{decision: allow; subject: non-editor; action: resign; resource: none; purpose: none; condition: he has already completed his review},collected_train
192,1804,The maintainer should make sure that enough disk space is available to store the papers.,1.0,{decision: allow; subject: maintainer; action: make; resource: disk space; condition: none; purpose: none},cyber
193,1829,The doctor will then have temporary access to the resident's medical records (but not to the private notes of the resident's ordinary doctor).,1.0,{decision: allow; subject: doctor; action: access; resource: residents medical records; purpose: none; condition: none | decision: deny; subject: doctor; action: access; resource: private notes of the residents ordinary doctor; purpose: none; condition: none},collected_train
194,1833,"The patient selects the type of appointment from a pull-down menu of the existing appointment types, enter the appointment date and start time (only a date or time equal or after the current date or time is allowed).",1.0,{decision: allow; subject: patient; action: select; resource: type of appointment; purpose: none; condition: none | decision: allow; subject: patient; action: enter; resource: appointment date; purpose: none; condition: none | decision: allow; subject: patient; action: enter; resource: start time; purpose: none; condition: none},acre
195,1842,The patient can select a diagnosis and will be presented with the LHCPs in the patient's living area (based upon the first three numbers of their zip code) who have handled this diagnosis in the last three years.,1.0,{decision: allow; subject: patient; action: select; resource: diagnosis; purpose: none; condition: none},acre
196,1864,The user can select an appointment from the calendar to read the appointment's details.,1.0,{decision: allow; subject: user; action: select; resource: appointment; purpose: read the appointments details; condition: none},t2p
197,1887,All members of FACULTY can ASSIGN both INTERNALGRADES and EXTERNALGRADES.,1.0,{decision: allow; subject: member of faculty; action: assign; resource: externalgrades; purpose: none; condition: none | decision: allow; subject: member of faculty; action: assign; resource: internalgrades; purpose: none; condition: none},collected
198,1893,An LHCP chooses to send a message to a patient or representative (no multiple recipients allowed in a single message).,1.0,{decision: allow; subject: lhcp; action: send; resource: message; purpose: none; condition: none},acre
199,1894,"During the submission phase, an author may submit a paper.",1.0,{decision: allow; subject: author; action: submit; resource: paper; purpose: none; condition: during the submission phase},collected
200,1911,doctors additionally should not provide specific notes about every resident.,1.0,{decision: deny; subject: doctors; action: provide; resource: specific notes about every resident; purpose: none; condition: none},collected_train
201,1913,Students cannot remain in degree offerings after eligibility for this current semester has been closed.,1.0,"{decision: deny; subject: students; action: remain; resource: degree offerings; purpose: none; condition: after eligibility for this current semester has been closed""}",collected_train
202,1943,The representative types the subject and the text of a message.,1.0,{decision: allow; subject: representative; action: type; resource: subject; purpose: none; condition: none | decision: allow; subject: representative; action: type; resource: text of a message; purpose: none; condition: none},t2p
203,1947,A sending HCP edits a previously sent patient referral .,1.0,{decision: allow; subject: hcp; action: edit; resource: referral; purpose: none; condition: none},acre
204,1964,The TA is prohibited to read the assigned internal or non-external grades (tc must take full responsibility for solving its problems) for the pupose of changing.,1.0,{decision: deny; subject: ta; action: read; resource: assigned internal grades; purpose: change; condition: none | decision: deny; subject: ta; action: read; resource: non-external grades; purpose: change; condition: none},collected_train
205,1967,"If a patient or Personal Progress Officer has completed only one survey on satisfaction with the doctor's visit as an office assignment, the patient may not complete the survey during a visit to the doctor.",1.0,"{decision: deny; subject: patient; action: complete; resource: survey; purpose: none; condition: ""patient or Personal Progress Officer has completed only one survey on satisfaction with the doctors visit as an office assignment""}",collected_train
206,1968,The table of contents and author index of the proceedings are generated by CyberChair and the camera-ready papers are prepared for electronic delivery to the publisher.,1.0,{decision: allow; subject: cyberchair; action: generate; resource: table of content; purpose: none; condition: none | decision: allow; subject: cyberchair; action: generate; resource: author index; purpose: none; condition: none | decision: allow; subject: cyberchair; action: prepare; resource: camera-ready paper; purpose: electronic delivery to the publisher; condition: none},cyber
207,1972,"A deactivated patient can not modified or log into the system, and can only be reactivated by the administrator.",1.0,{decision: deny; subject: none; action: modify; resource: deactivated patient; purpose: none; condition: none | decision: deny; subject: deactivated patient; action: log; resource: system; purpose: none; condition: none | decision: allow; subject: administrator; action: reactivate; resource: deactivated patient; purpose: none; condition: none},acre
208,1974,The licensed health care professional making a diagnosis determines if a patient is granted the ability to restrict viewing of the diagnosis.,1.0,{decision: allow; subject: licensed health care professional; action: determine; resource: ability; purpose: none; condition: none},acre
209,1977,The LHCP enters and confirms the patient or representative's MID .,1.0,{decision: allow; subject: lhcp; action: enter; resource: patients mid; purpose: none; condition: none | decision: allow; subject: lhcp; action: enter; resource: representatives mid; purpose: none; condition: none | decision: allow; subject: lhcp; action: confirm; resource: patients mid; purpose: none; condition: none | decision: allow; subject: lhcp; action: confirm; resource: representatives mid; purpose: none; condition: none},acre
210,1979,"Users can view an Owner's account, but not make changes",1.0,{decision: allow; subject: user; action: view; resource: owner account; purpose: none; condition: none | decision: deny; subject: user; action: change; resource: owner account; purpose: none; condition: none},collected
211,1987,"An LHCP, patient or representative can modify his ""messagedisplayingfilter"" by modifying the following filtering criteria.",1.0,"{decision: allow; subject: lhcp; action: modify; resource: ""messagedisplayingfilter”; purpose: none; condition: none | decision: allow; subject: patient; action: modify; resource: ""messagedisplayingfilter”; purpose: none; condition: none | decision: allow; subject: representative; action: modify; resource: ""messagedisplayingfilter”; purpose: none; condition: none}",t2p
212,1989,"In the current paper system, all the information stored about a resident is accessible to the resident by arrangement with the manager.",1.0,{decision: allow; subject: resident; action: access; resource: information; condition: none; purpose: none},collected
213,1991,The LHCP clicks this number to view the physiologic data monitoring details of his or her patients for the current date.,1.0,{decision: allow; subject: lhcp; action: click; resource: number; purpose: view the physiologic data monitoring details; condition: none},acre
214,2003,"If the subject is a student, subject should not to take this class off the grades.",1.0,{decision: deny; subject: subject; action: take; resource: class; condition: subject is a student; purpose: none},collected_train
215,2014,The system requests that the Registrar enter the professor id.,1.0,{decision: allow; subject: registrar; action: enter; resource: professor id; purpose: none; condition: none},ibm
216,2044,"By default, the messages in the message inbox should be ordered by timestamp, the most recent first.",1.0,{decision: allow; subject: none; action: order; resource: message; purpose: none; condition: none},t2p
217,2047,The administrator is generally not permitted to delete unauthorized entries.,1.0,{decision: deny; subject: administrator; action: delete; resource: unauthorized entries; purpose: none; condition: none},collected_train
218,2050,For administrative purposes any authenticated user can delete Resource C.,1.0,{decision: allow; subject: authenticated user; action: delete; resource: c; condition: none; purpose: administrative purposes},collected_train
219,2058,"The patient may sort the list of referrals by receiving HCP name, time generated, possibly and possibly priority.",1.0,{decision: allow; subject: patient; action: sort; resource: list of referrals; purpose: none; condition: none},acre
220,2076,"The HCP confirms the reassignment, or cancels the reassignment .",1.0,{decision: allow; subject: hcp; action: confirm; resource: reassignment; purpose: none; condition: none | decision: allow; subject: hcp; action: cancel; resource: reassignment; purpose: none; condition: none},acre
